{
  "spec_version": "mis/0.1",
  "id": "ISSUE-0001",
  "title": "Draft the first markdown issue tracking spec",
  "kind": "task",
  "status": "proposed",
  "created_at": "2026-03-22T10:24:00-05:00",
  "updated_at": "2026-03-22T10:24:00-05:00",
  "priority": "high",
  "labels": [
    "spec",
    "core"
  ],
  "links": [
    {
      "rel": "references",
      "target": "ISSUE-0009",
      "note": "Background research issue on agent-first workflows"
    }
  ],
  "extensions": {
    "acme/story_points": 3
  }
}
